{
  "$schema": "https://json-schema.org/draft/2020-12/schema",
  "additionalProperties": false,
  "description": "Authoring shape generated from Go configuration types. Run soot check for semantic validation and cross-file grants.",
  "properties": {
    "$schema": {
      "type": [
        "string",
        "null"
      ]
    },
    "adapter": {
      "type": [
        "string",
        "null"
      ]
    },
    "archived": {
      "type": [
        "boolean",
        "null"
      ]
    },
    "avatar": {
      "type": [
        "string",
        "null"
      ]
    },
    "channels": {
      "items": {
        "additionalProperties": false,
        "properties": {
          "id": {
            "type": [
              "string",
              "null"
            ]
          },
          "name": {
            "type": [
              "string",
              "null"
            ]
          }
        },
        "type": [
          "object",
          "null"
        ]
      },
      "type": [
        "array",
        "null"
      ]
    },
    "compact_at": {
      "type": [
        "integer",
        "null"
      ]
    },
    "conversation": {
      "additionalProperties": false,
      "properties": {
        "memory_workspace_write": {
          "type": [
            "boolean",
            "null"
          ]
        },
        "publish": {
          "type": [
            "string",
            "null"
          ]
        }
      },
      "type": [
        "object",
        "null"
      ]
    },
    "description": {
      "description": "One-line summary shown when users choose this Soot.",
      "maxLength": 160,
      "type": "string"
    },
    "execution": {
      "additionalProperties": false,
      "properties": {
        "advisor": {
          "type": [
            "boolean",
            "null"
          ]
        },
        "concurrent_jobs": {
          "type": [
            "integer",
            "null"
          ]
        },
        "continue_on_limit": {
          "type": [
            "boolean",
            "null"
          ]
        },
        "daily_tokens": {
          "type": [
            "integer",
            "null"
          ]
        },
        "max_output_tokens": {
          "type": [
            "integer",
            "null"
          ]
        },
        "max_result_bytes": {
          "type": [
            "integer",
            "null"
          ]
        },
        "max_run_tokens": {
          "type": [
            "integer",
            "null"
          ]
        },
        "max_tool_calls": {
          "type": [
            "integer",
            "null"
          ]
        },
        "max_turns": {
          "type": [
            "integer",
            "null"
          ]
        },
        "memory_consolidation": {
          "type": [
            "boolean",
            "null"
          ]
        },
        "operation_output_bytes": {
          "type": [
            "integer",
            "null"
          ]
        },
        "run_timeout": {
          "type": [
            "string",
            "null"
          ]
        },
        "self_tools": {
          "items": {
            "type": [
              "string",
              "null"
            ]
          },
          "type": [
            "array",
            "null"
          ]
        },
        "subagent_depth": {
          "type": [
            "integer",
            "null"
          ]
        },
        "subagents": {
          "type": [
            "integer",
            "null"
          ]
        },
        "todo_nudges": {
          "type": [
            "integer",
            "null"
          ]
        },
        "tool_timeout": {
          "type": [
            "string",
            "null"
          ]
        }
      },
      "type": [
        "object",
        "null"
      ]
    },
    "feedback": {
      "additionalProperties": false,
      "properties": {
        "group": {
          "type": [
            "string",
            "null"
          ]
        },
        "pool": {
          "type": [
            "string",
            "null"
          ]
        },
        "to": {
          "type": [
            "string",
            "null"
          ]
        }
      },
      "type": [
        "object",
        "null"
      ]
    },
    "host_packs": {
      "description": "Repository Soots only: host packs to ask the host for, such as browser-use or data-pool:read. Nothing changes until the host allows each one in Nest.",
      "items": {
        "pattern": "^[a-z0-9][a-z0-9_-]{0,63}(:read)?$",
        "type": "string"
      },
      "maxItems": 16,
      "type": [
        "array",
        "null"
      ],
      "uniqueItems": true
    },
    "id": {
      "pattern": "^[a-z0-9][a-z0-9_-]{0,63}$",
      "type": "string"
    },
    "improve": {
      "additionalProperties": false,
      "description": "Run soot improve on a cadence: evals, diagnosis, then a configuration proposal or adapter tuning within budget. Produces proposals for review; applies nothing.",
      "properties": {
        "at": {
          "description": "Wall-clock anchor HH:MM, such as 03:00.",
          "pattern": "^([01][0-9]|2[0-3]):[0-5][0-9]$",
          "type": "string"
        },
        "budget": {
          "description": "Weighted tokens one scheduled run may spend, evals included.",
          "minimum": 1,
          "type": "integer"
        },
        "every": {
          "description": "Cadence, a Go duration from 6h to 744h, such as 24h or 168h.",
          "type": "string"
        },
        "min_failing": {
          "description": "Failing cases that start a fix; fewer stops after the eval. Default 1.",
          "minimum": 0,
          "type": "integer"
        },
        "paused": {
          "description": "Keep the setting but do not run.",
          "type": "boolean"
        },
        "proposer": {
          "description": "Soot that writes proposals; give it the strongest model you have. Default: the Soot itself.",
          "type": "string"
        },
        "timezone": {
          "description": "IANA timezone for at, such as Asia/Ho_Chi_Minh. Default UTC.",
          "type": "string"
        }
      },
      "required": [
        "every",
        "budget"
      ],
      "type": [
        "object",
        "null"
      ]
    },
    "interaction": {
      "additionalProperties": false,
      "properties": {
        "handoff": {
          "enum": [
            "",
            "members"
          ],
          "type": [
            "string",
            "null"
          ]
        },
        "mode": {
          "enum": [
            "interactive",
            "autonomous"
          ],
          "type": [
            "string",
            "null"
          ]
        }
      },
      "type": [
        "object",
        "null"
      ]
    },
    "knowledge": {
      "items": {
        "type": [
          "string",
          "null"
        ]
      },
      "type": [
        "array",
        "null"
      ]
    },
    "mascot": {
      "type": [
        "string",
        "null"
      ]
    },
    "mission": {
      "description": "Relative Markdown file for the agent task.",
      "type": [
        "string",
        "null"
      ]
    },
    "model": {
      "additionalProperties": false,
      "description": "Optional overrides of the shared deployment model and fallback/retry policy. Omit to inherit everything.",
      "properties": {
        "auxiliary_effort": {
          "type": [
            "string",
            "null"
          ]
        },
        "context_window": {
          "type": [
            "integer",
            "null"
          ]
        },
        "effort": {
          "type": [
            "string",
            "null"
          ]
        },
        "fallbacks": {
          "description": "Omitted/null inherits the shared chain with its original providers; [] disables fallback. An explicit list replaces the chain; omitted providers use this Soot's primary provider.",
          "items": {
            "additionalProperties": false,
            "properties": {
              "auxiliary_effort": {
                "type": [
                  "string",
                  "null"
                ]
              },
              "context_window": {
                "type": [
                  "integer",
                  "null"
                ]
              },
              "effort": {
                "type": [
                  "string",
                  "null"
                ]
              },
              "name": {
                "type": [
                  "string",
                  "null"
                ]
              },
              "provider": {
                "type": [
                  "string",
                  "null"
                ]
              }
            },
            "type": [
              "object",
              "null"
            ]
          },
          "maxItems": 4,
          "type": [
            "array",
            "null"
          ]
        },
        "name": {
          "type": [
            "string",
            "null"
          ]
        },
        "provider": {
          "type": [
            "string",
            "null"
          ]
        },
        "retry": {
          "additionalProperties": false,
          "description": "Partial override of shared retry policy; omitted/null/empty fields inherit. max_attempts: 1 disables retries.",
          "properties": {
            "base_delay": {
              "type": [
                "string",
                "null"
              ]
            },
            "max_attempts": {
              "type": [
                "integer",
                "null"
              ]
            },
            "max_delay": {
              "type": [
                "string",
                "null"
              ]
            }
          },
          "type": [
            "object",
            "null"
          ]
        }
      },
      "type": [
        "object",
        "null"
      ]
    },
    "name": {
      "description": "Display name shown in clients and substituted for {{name}} in the soul file. Default: Soot.",
      "maxLength": 64,
      "type": "string"
    },
    "operations": {
      "items": {
        "type": [
          "string",
          "null"
        ]
      },
      "type": [
        "array",
        "null"
      ]
    },
    "packs": {
      "description": "Installed packs this Soot uses: \"office\" grants all of the pack's skills and tools, \"office:read\" its skills and read-only tools.",
      "items": {
        "pattern": "^[a-z0-9][a-z0-9_-]{0,63}(:read)?$",
        "type": "string"
      },
      "maxItems": 32,
      "type": [
        "array",
        "null"
      ]
    },
    "skills": {
      "items": {
        "additionalProperties": false,
        "properties": {
          "description": {
            "description": "Explain when the agent should use this skill. Omitted: read from the file's YAML frontmatter description (Agent Skills SKILL.md); a pack skill without either gets a generic one. A file named SKILL.md takes its folder name.",
            "type": [
              "string",
              "null"
            ]
          },
          "file": {
            "minLength": 1,
            "type": "string"
          },
          "name": {
            "type": [
              "string",
              "null"
            ]
          }
        },
        "required": [
          "file"
        ],
        "type": [
          "object",
          "null"
        ]
      },
      "type": [
        "array",
        "null"
      ]
    },
    "soul": {
      "description": "Relative Markdown file for personality and principles.",
      "type": [
        "string",
        "null"
      ]
    },
    "targets": {
      "items": {
        "type": [
          "string",
          "null"
        ]
      },
      "type": [
        "array",
        "null"
      ]
    },
    "tier": {
      "type": [
        "string",
        "null"
      ]
    },
    "tools": {
      "items": {
        "type": [
          "string",
          "null"
        ]
      },
      "type": [
        "array",
        "null"
      ]
    }
  },
  "required": [
    "id"
  ],
  "title": "Soot soot",
  "type": "object"
}
