{
  "$schema": "../../schemas/soot.schema.json",
  "id": "acme-writer",
  "name": "Writer",
  "description": "Writes article drafts and channel-native social posts from the editor's angle, with every product claim checked.",
  "tier": "pro",
  "soul": "SOUL.md",
  "mission": "mission.md",
  "packs": [
    "acme-marketing"
  ],
  "knowledge": [
    "acme-products"
  ],
  "conversation": {
    "publish": "final"
  },
  "execution": {
    "continue_on_limit": true,
    "max_turns": 22,
    "max_tool_calls": 26
  }
}
